uid,salary_fairness,compensation_competitiveness,benefits_adequacy,workload_balance,schedule_flexibility,leave_policies_adequacy,workplace_safety_comfort,positive_inclusive_culture,access_to_tools_resources,professional_growth_opportunities,training_skill_development,clear_career_paths,manager_communication_clarity,raising_concerns_comfortability,manager_support_for_employees,job_security_feeling,organizational_financial_stability,open_communication_on_changes,team_collaboration_effectiveness,colleague_respect_support,constructive_conflict_management,clear_job_responsibilities,autonomy_in_role,role_alignment_with_skills,acknowledgement_of_contributions,fair_performance_evaluations,fair_rewards_for_effort,mission_values_meaningful,encouragement_of_innovation,Company_acts_ethically,free_text_box,sentiment_label
9da6b385-7a3b-4cc2-a903-edb135b1cb87,1,1,1,2,2,1,1,2,2,1,2,2,1,2,1,1,2,1,2,1,1,1,2,1,1,1,2,2,2,2,"My contributions feel completely difficult, and I am not difficult for my work.",Negative
620fce0c-03cb-4d0d-99b2-4f8e69a57c9a,1,2,1,1,2,1,1,2,2,2,2,2,2,1,2,1,2,1,1,1,2,2,2,2,1,1,2,1,1,1,The recent organizational changes were communicated in a unbearable manner.,Negative
778c5d52-b71e-48ec-8f29-3cf27db11981,3,3,4,4,4,4,3,4,4,4,4,3,3,3,4,3,3,3,3,4,3,3,3,4,3,3,3,4,3,3,The training provided is okay. It serves its purpose.,Neutral
d93f2e4f-fb7c-4436-921b-a22aa7d95a6f,3,3,3,3,3,3,4,3,3,4,4,3,3,3,3,4,4,3,4,3,4,4,3,4,3,4,4,4,3,3,The training provided is expected. It serves its purpose.,Neutral
1043f796-905f-45bf-aea0-9cd9baf1ed5a,5,5,4,4,4,4,4,5,5,5,5,4,4,5,5,5,5,4,5,5,4,5,5,5,4,4,4,4,5,5,The professional growth opportunities here are fantastic.,Positive
8481eed1-d921-49ab-a93d-908c34083132,4,4,4,3,4,3,3,4,3,4,3,3,4,3,4,3,4,3,3,3,3,4,3,3,3,3,3,3,4,4,I find the level of autonomy to be expected.,Neutral
6b538d71-894c-45b7-b577-cd47a7ed6fd4,5,4,5,5,5,5,4,5,5,4,5,5,4,4,4,4,4,4,4,4,5,4,5,5,5,5,5,5,4,5,My manager is so love. I am love with the leadership.,Positive
75887b7c-4432-4a24-81b8-c6ced803e462,1,2,2,1,2,1,1,1,1,2,2,2,2,1,2,2,2,1,1,2,2,1,1,1,1,2,1,1,1,1,The tools and resources provided are unhappy to perform my job effectively.,Negative
8f3ace31-8587-4b4a-ae08-f36d69c3b7e7,2,2,1,2,2,2,1,1,2,1,2,2,2,2,2,1,1,2,2,2,2,1,2,2,2,2,2,2,1,2,"My contributions feel completely problem, and I am not problem for my work.",Negative
dd505cd3-d3ce-44a2-9aa0-0f5a8907a86e,2,2,1,2,2,1,2,2,2,1,2,2,1,2,2,2,2,1,2,1,2,2,2,1,1,2,2,2,1,1,I've found career progression to be unhappy and unclear.,Negative
623af364-262b-4adb-b500-dbba4a09be50,4,5,5,5,4,4,5,5,5,5,5,5,5,5,5,5,5,4,5,4,4,5,4,4,5,4,5,5,4,5,The compensation is great and I feel great great.,Positive
c9823d4a-b713-4c29-af5c-ba7dd898b28e,5,4,5,4,4,4,5,4,5,4,5,4,4,5,5,5,5,4,5,4,4,5,5,4,5,5,5,4,4,4,I'm truly excellent with the recognition I've received.,Positive
eb2cd24a-717b-4288-9203-e5d5e0b8c88f,4,3,4,3,4,4,4,3,3,4,4,3,3,3,3,3,4,4,3,4,3,3,4,3,3,3,4,3,3,4,The training provided is fine. It serves its purpose.,Neutral
01871001-8108-448c-99f0-979fac27ef53,4,4,5,5,4,4,5,5,4,5,4,5,4,4,4,4,4,5,5,4,4,4,5,4,4,5,4,5,5,5,The workplace environment is enjoy and promotes enjoy collaboration.,Positive
eebc3cdd-3c12-488c-9e2b-8c527bfe2612,2,2,1,1,1,2,1,2,2,1,1,1,1,1,1,2,2,1,1,2,2,1,1,2,1,1,2,2,2,2,The workload is unhappy and I have a unhappy work-life balance.,Negative
248efb60-b74c-48bb-87f8-67096fa2dc05,3,3,4,4,3,4,4,3,3,3,4,3,3,3,3,4,4,4,4,3,3,4,3,4,4,4,3,4,3,4,My job is typical. The responsibilities are typical.,Neutral
227cc3a9-e88b-49f4-b379-3dac6fce7b84,1,1,1,1,2,1,2,2,1,1,1,2,2,1,1,1,1,1,1,2,2,2,2,1,1,2,2,2,2,1,"My contributions feel completely difficult, and I am not difficult for my work.",Negative
63bae24f-7057-4eec-8e38-e42995f11434,2,2,1,1,2,1,1,1,2,2,1,1,2,1,2,1,1,1,2,1,2,2,1,2,1,2,2,2,1,1,I'm stagnant with my salary. It is stagnant for my experience.,Negative
cf8f79fd-fd6f-4a55-b2d0-1fdac3a2598e,4,4,4,4,5,4,5,5,5,4,4,4,5,4,4,5,5,4,5,5,4,5,5,5,4,4,4,5,4,4,I'm truly wonderful with the recognition I've received.,Positive
e6e3fe28-27ee-4554-a458-ac9d73b78a10,2,2,2,2,2,2,2,2,2,2,2,2,1,1,1,2,1,2,1,1,2,1,2,2,2,1,1,1,1,2,The recent organizational changes were communicated in a problem manner.,Negative
6b53ea50-078a-4158-9de4-1b0ea60eb4a7,5,4,4,5,5,4,5,5,4,5,4,4,5,4,4,4,5,5,5,4,5,4,4,4,5,4,5,4,5,5,I am excellent with the company culture.,Positive
2c83c1b2-be23-4b8f-b49b-bc57d2a0e78e,1,1,1,1,2,2,1,2,2,2,2,1,2,1,1,2,2,1,2,2,2,1,2,1,1,1,2,2,1,2,I've found career progression to be problem and unclear.,Negative
19ea1045-65c4-4929-be83-37e36c7211df,4,3,4,4,3,4,3,4,3,3,3,4,4,4,4,3,3,3,4,4,3,4,4,3,4,3,3,4,3,4,Performance evaluations are acceptable and generally follow the same format.,Neutral
0914b4fb-c55e-41ee-b434-c3b026b57f90,1,1,1,2,2,2,1,1,2,2,1,1,1,2,1,2,2,1,1,2,2,1,1,2,2,2,2,1,1,1,Communication is a unhappy here. I am unhappy with management.,Negative
4ddf75bc-4c95-47e1-a96d-b7824acec9a6,5,4,5,4,4,4,4,4,5,4,4,4,4,5,4,4,4,4,4,5,5,5,5,4,4,5,5,5,4,4,My manager is so valued. I am valued with the leadership.,Positive
1ce90506-8963-41bd-a506-d19c62bf2e08,3,3,3,3,3,3,3,3,3,4,3,4,4,3,4,4,3,3,4,3,4,3,4,3,3,3,4,4,3,4,My benefits are acceptable and meet my basic needs.,Neutral
555d80c0-2db5-46af-acd5-5476d595f3ce,4,4,3,4,3,4,4,3,4,4,4,3,4,4,3,3,3,3,3,4,4,4,3,3,3,4,3,3,3,3,The company's approach to innovation is quite standard.,Neutral
f15a3020-12a8-4180-8bf6-8f11232a490a,4,4,4,4,3,3,3,3,4,3,4,4,3,3,3,4,4,3,4,4,4,3,4,3,4,3,3,4,4,4,My job is fine. The responsibilities are fine.,Neutral
3ed0a3c3-3a80-4fd5-bb24-0df6718f1c16,5,5,4,5,4,4,4,4,5,5,5,5,4,4,4,4,5,5,5,4,5,4,4,5,5,5,5,4,4,5,I am excellent with the company culture.,Positive
f9859585-903f-4a9c-bd6a-04c40009ad25,5,5,4,5,5,4,4,5,4,5,5,4,5,5,5,5,5,5,4,4,4,5,4,4,4,5,5,4,5,5,The workplace environment is wonderful and promotes wonderful collaboration.,Positive
0f14e9a8-79c5-4258-8579-90817e57fade,4,4,3,4,4,3,3,3,4,3,4,4,4,3,3,3,4,3,4,3,3,4,3,4,3,3,3,4,4,4,The training provided is normal. It serves its purpose.,Neutral
d4662aed-b055-422d-8c2d-df179fa31926,4,4,4,4,5,5,5,5,4,4,5,5,5,4,5,5,5,4,5,5,4,5,4,4,4,5,4,5,4,4,The compensation is enjoy and I feel enjoy enjoy.,Positive
1778910d-9ea4-46f2-8ae9-eceae734c3f6,3,4,4,4,3,4,3,4,4,3,4,3,3,4,3,3,3,4,4,3,3,4,3,4,3,3,3,4,3,3,Performance evaluations are standard and generally follow the same format.,Neutral
f0cc04a9-5d9b-456f-a72f-d27c319094e3,1,2,1,2,2,1,1,1,2,1,2,2,1,1,2,1,1,1,2,1,1,1,1,1,1,1,1,2,1,2,There's a poor culture and a poor of respect.,Negative
a873171f-7c0f-4cba-822e-2e8bdac4bec0,5,4,4,4,5,5,5,5,5,4,4,5,5,4,4,5,4,4,4,4,5,4,4,4,4,5,4,5,5,5,The company's mission is enjoy and I feel aligned with its values.,Positive
5647d49c-a727-4b9c-9ecb-6b77d62f0159,1,2,1,2,2,2,1,2,1,1,1,2,2,2,2,2,1,2,2,1,1,1,1,1,2,2,2,1,1,1,I'm unbearable with my salary. It is unbearable for my experience.,Negative
95d81d35-c60b-4992-8bac-de0d0a5ecb21,3,4,4,4,3,3,4,3,4,4,3,4,3,4,4,3,4,4,4,3,3,4,3,4,3,4,3,4,4,3,My benefits are expected and meet my basic needs.,Neutral
10379b7c-f930-4ae2-a88a-144ccaf43079,5,4,5,4,4,4,4,5,5,5,4,5,5,5,5,5,5,5,4,4,4,5,5,5,5,5,5,4,4,4,The professional growth opportunities here are great.,Positive
d7c4c338-8a17-442b-aeb5-91e16eb34708,4,5,5,4,5,4,5,4,5,5,5,5,5,5,4,5,5,5,4,5,5,5,4,5,4,4,4,5,5,5,The company's mission is great and I feel aligned with its values.,Positive
79faf5a8-2245-450c-ac76-340ef1d040ee,4,4,4,4,3,3,4,3,4,4,3,4,4,4,3,4,3,4,3,3,4,4,3,3,3,3,3,3,4,3,The company's approach to innovation is quite fine.,Neutral
2bc7c0c3-f3b8-498e-b3ad-bb6b7f56d8ae,3,4,4,3,3,4,3,3,3,3,4,4,3,4,4,4,3,3,4,3,4,3,3,4,3,3,3,4,3,3,I have mixed feelings. The new policy is expected.,Neutral
a375ebc3-4add-4176-90a5-b786a27fb4b0,4,4,3,3,3,4,4,4,3,3,4,3,3,3,4,4,3,3,4,3,3,3,3,3,3,4,3,4,3,4,I find the level of autonomy to be adequate.,Neutral
255764b9-76c9-404b-baa9-0cddbef69b94,2,1,2,2,1,1,2,2,1,2,2,2,1,2,2,1,1,1,1,2,2,2,2,2,2,2,2,1,1,2,"My contributions feel completely difficult, and I am not difficult for my work.",Negative
3647e5a5-8b6a-4930-bb62-b853b92be0d9,3,4,3,3,4,4,3,4,4,3,4,4,3,3,4,3,3,4,3,3,3,4,4,3,3,3,3,4,3,4,I find the level of autonomy to be expected.,Neutral
a55a5453-73b5-4519-8fd1-fc76b6f6a54a,2,2,1,1,2,2,2,2,1,2,2,2,2,1,2,1,1,2,1,1,1,1,1,2,1,2,2,1,2,1,I'm problem with my salary. It is problem for my experience.,Negative
97d2d651-c88f-412d-a055-4a3df1648921,3,4,4,3,4,3,3,3,3,4,3,4,3,3,3,4,3,3,4,4,3,3,3,4,3,4,4,3,4,3,Everything is just acceptable. There's nothing much to say.,Neutral
e17cd80a-12d8-4e89-bd73-0742cfa424e0,3,4,3,4,3,3,4,3,4,4,4,3,3,4,4,3,4,4,4,3,4,3,4,4,3,3,3,3,3,4,Everything is just regular. There's nothing much to say.,Neutral
bfd503a4-7bb0-4d42-b8fa-9e2b2056fc06,1,2,2,1,2,1,1,1,1,2,1,1,2,2,2,1,1,1,2,2,2,1,2,2,1,2,2,2,1,1,Communication is a problem here. I am problem with management.,Negative
d56212d9-ec35-44e0-99d6-9e6166a863e0,4,4,4,4,5,4,4,4,4,5,4,5,5,5,4,4,5,4,4,5,5,4,5,5,4,4,4,5,4,5,I'm truly excellent with the recognition I've received.,Positive
44e37112-329a-4558-97a8-d4be6d7733f7,2,1,1,2,2,2,2,1,1,1,2,1,1,1,2,1,1,1,2,1,2,1,1,2,2,2,2,2,1,2,Communication is a unbearable here. I am unbearable with management.,Negative
58a6ebac-c1f5-4629-9abd-704cbc27de8a,5,5,5,5,4,4,4,5,4,5,4,5,4,5,4,5,5,5,5,5,5,5,5,4,4,4,5,4,5,4,The compensation is fantastic and I feel fantastic fantastic.,Positive
8b4e0ce5-fa9f-45ee-8a28-6f8b51e66a2e,4,4,3,3,3,4,4,3,3,3,3,3,4,4,3,3,3,3,4,4,3,3,4,4,3,3,4,4,4,3,My job is normal. The responsibilities are normal.,Neutral
479d71ec-c2c7-4658-abb7-4c619f1181af,3,3,4,3,4,3,4,4,4,4,4,4,3,3,4,3,3,3,3,4,3,4,3,3,4,3,4,4,4,3,The training provided is normal. It serves its purpose.,Neutral
87cc40c1-b6a5-45fe-85d2-9b413bec4aba,4,5,5,4,4,5,4,5,4,4,4,4,4,5,4,4,5,5,4,5,5,5,4,4,5,4,5,5,5,4,The compensation is supportive and I feel supportive supportive.,Positive
447e2f39-890a-4ff7-8e29-9f57bb640337,4,5,4,5,4,5,4,4,5,5,4,4,5,5,5,4,4,5,4,4,5,4,4,4,4,5,5,4,4,4,I'm truly valued with the recognition I've received.,Positive
b3fcd448-3550-447d-a4bd-98527548e6df,4,4,3,3,4,4,4,4,4,4,4,4,3,3,4,3,4,4,4,3,3,4,4,3,4,4,4,4,4,4,My benefits are typical and meet my basic needs.,Neutral
f9553803-80e0-4fdc-b38d-547112254f67,1,2,1,2,2,1,2,2,1,2,1,1,2,1,2,2,2,2,1,1,1,1,2,2,1,2,1,1,2,1,I'm low with my salary. It is low for my experience.,Negative
2f3be514-2b0b-47a8-85fe-65fd54fc5c34,3,4,4,3,3,3,4,3,3,4,3,3,3,4,3,3,4,3,3,3,4,4,3,3,3,4,4,4,3,4,Performance evaluations are standard and generally follow the same format.,Neutral
3b95537d-3da5-44bd-9941-78ced8f22193,2,1,2,2,1,2,2,1,1,2,1,1,1,1,1,1,1,2,1,2,2,2,1,2,2,2,2,1,1,1,The workload is terrible and I have a terrible work-life balance.,Negative
a74fdc28-383b-488a-bf3a-2ba176eae384,1,1,1,1,1,1,1,2,2,2,2,1,2,1,2,2,1,1,1,2,2,2,2,1,2,2,2,2,1,2,The tools and resources provided are stagnant to perform my job effectively.,Negative
16ad9172-fa7b-47d1-b87f-373ab8428a45,5,5,5,4,4,4,4,5,5,5,4,4,5,5,5,5,5,4,5,5,4,5,4,5,5,5,5,5,4,4,The company's mission is supportive and I feel aligned with its values.,Positive
bf97a048-6e4a-448e-ab48-5b58406a9c39,3,4,3,3,4,3,3,4,4,4,3,3,3,4,4,4,3,4,3,3,3,3,3,3,3,4,3,3,4,4,My job is adequate. The responsibilities are adequate.,Neutral
847f440a-1250-4a3f-b1cf-74c744601466,4,3,3,4,3,4,4,4,4,3,3,3,4,3,3,3,3,3,4,3,3,4,4,4,4,4,4,3,4,4,The training provided is fine. It serves its purpose.,Neutral
c424c190-2d38-4440-b1c9-ec60e4fbe554,3,4,4,4,3,4,3,4,4,3,4,4,3,3,3,3,3,3,4,4,3,4,3,4,4,3,4,3,3,4,Performance evaluations are average and generally follow the same format.,Neutral
a66105f1-7f26-459a-87e7-fb1f8ffe3a39,4,4,4,4,3,4,4,4,4,4,3,3,4,4,4,4,3,3,3,4,3,4,4,3,3,4,3,3,4,3,My benefits are average and meet my basic needs.,Neutral
9a878fa5-bd46-40f9-aa0b-79c681f87140,2,1,1,2,2,2,2,2,2,1,1,2,1,2,1,1,1,1,1,1,1,1,1,2,1,2,1,2,2,1,The tools and resources provided are low to perform my job effectively.,Negative
e86971ab-78ac-48bb-8613-61993a591300,4,5,5,4,4,5,5,5,4,4,4,4,5,4,5,4,5,4,5,4,5,5,5,5,4,4,5,4,5,5,The professional growth opportunities here are supportive.,Positive
8401d45f-554a-4750-aa28-ae378fcaf677,2,2,1,2,2,1,2,1,1,1,1,2,1,2,1,1,2,1,2,2,2,1,2,1,2,1,1,2,2,2,The recent organizational changes were communicated in a toxic manner.,Negative
9f9b07d3-e606-4e86-923b-33e7851d7907,1,2,2,2,1,1,1,1,1,2,2,2,2,2,1,2,2,2,1,1,2,2,2,2,1,1,2,1,2,2,The workload is low and I have a low work-life balance.,Negative
8ccd9338-6ad5-4e74-b18c-2335feb24205,3,3,3,4,3,4,4,3,4,3,4,3,4,4,4,3,3,4,4,4,4,3,3,4,3,3,4,4,4,3,I have mixed feelings. The new policy is regular.,Neutral
e60ed5e4-7019-448f-afb5-5d8239c01b14,4,3,3,4,4,4,4,3,4,4,3,4,3,3,3,3,3,3,3,4,3,4,3,3,3,4,4,3,3,3,The company's approach to innovation is quite okay.,Neutral
93e556b1-9181-482c-9c26-14b8206b6bd1,4,4,5,4,4,5,5,4,4,5,4,4,4,5,5,5,4,4,4,4,5,5,4,5,4,5,4,5,5,4,I am enjoy with the company culture.,Positive
bdc8cc60-7c0d-457b-a79b-aa7fee9a67b3,2,2,1,2,2,1,1,2,1,1,1,2,1,1,1,1,2,2,1,1,2,1,1,2,1,2,1,2,1,1,Communication is a unhappy here. I am unhappy with management.,Negative
85983cb3-1e2c-475f-93b0-8fb108eeb885,4,4,3,3,3,4,3,4,4,4,3,3,4,3,3,3,3,4,3,4,4,4,4,3,3,3,3,3,3,3,The training provided is acceptable. It serves its purpose.,Neutral
2681c00e-c803-4c92-847f-3db1465f1bf2,4,4,4,4,3,3,4,3,3,3,4,3,3,3,4,3,3,3,4,3,4,3,4,4,4,3,3,4,4,4,I have mixed feelings. The new policy is average.,Neutral
5793f266-4352-4038-8007-a2ce370f8cdb,3,3,4,3,3,4,3,3,4,3,4,3,3,3,4,4,4,4,3,4,3,4,3,4,3,3,4,3,4,3,My benefits are normal and meet my basic needs.,Neutral
f4767489-0250-4684-81fa-f8801b163b67,4,4,5,5,5,4,4,5,4,4,4,5,4,4,5,5,4,5,4,5,4,4,4,5,5,4,4,4,5,5,My manager is so wonderful. I am wonderful with the leadership.,Positive
cd7a76cb-83eb-4fa6-adf7-419f53b0bd32,2,1,2,2,1,2,1,2,1,2,1,2,1,1,2,2,1,2,1,1,2,2,2,1,1,2,1,1,2,1,"My contributions feel completely mess, and I am not mess for my work.",Negative
c7c2b940-ca7a-4b56-b353-020fdb2dd96b,4,4,4,4,4,5,4,5,5,5,4,5,5,5,5,4,4,5,4,5,4,5,5,5,5,5,5,4,5,5,I feel supportive about my job. The team is supportive.,Positive
cbdce3ee-5af2-437e-bd2c-985c41b44ce7,5,4,5,4,5,4,4,4,4,5,5,4,4,5,5,4,4,4,4,5,4,4,4,5,5,5,4,5,5,4,I feel fantastic about my job. The team is fantastic.,Positive
57dbf044-f3c0-4690-8a70-bc3a4d2246b0,3,4,4,4,4,3,3,3,4,4,3,4,3,4,4,4,3,4,3,3,3,3,3,3,4,3,3,3,3,3,The company's approach to innovation is quite adequate.,Neutral
c502e118-a4e0-4cbd-a940-e514f286fed2,5,5,5,5,4,5,4,5,5,5,4,4,4,4,5,5,5,5,4,4,5,5,4,4,5,4,5,4,5,5,I am wonderful with the company culture.,Positive
dcb83b90-d99c-4d7b-9787-1835cb1cb646,1,1,1,1,2,2,2,2,2,1,1,1,2,1,1,1,1,2,1,1,1,1,2,1,2,1,2,2,2,2,There's a difficult culture and a difficult of respect.,Negative
7ce3c60f-3664-4e1c-b774-99185f8cf194,4,4,5,4,5,5,4,5,5,5,4,5,4,4,5,5,4,4,4,5,5,4,5,4,5,4,5,4,4,5,My manager is so proud. I am proud with the leadership.,Positive
0c249e6c-8eeb-4aaa-a039-241147113c58,2,2,1,1,1,1,1,2,2,2,2,2,2,1,2,1,1,2,1,1,2,2,1,1,2,2,1,2,1,2,"My contributions feel completely mess, and I am not mess for my work.",Negative
86ab727f-0f9b-499b-92cd-4167aa30d844,4,5,5,5,5,4,4,4,5,5,4,4,4,4,5,4,5,5,5,5,4,5,4,5,4,5,5,4,5,5,The workplace environment is excellent and promotes excellent collaboration.,Positive
de23b708-a04d-4cef-a477-10a409f56805,5,4,4,5,5,5,5,5,5,5,4,5,5,4,4,4,4,5,4,5,5,5,5,5,4,5,5,4,4,5,The compensation is fantastic and I feel fantastic fantastic.,Positive
ad59f902-c8ed-4087-9079-e91ad7349572,2,1,1,1,2,2,1,2,1,1,2,2,2,2,2,2,2,2,2,2,2,1,2,1,2,2,2,1,1,2,I've found career progression to be difficult and unclear.,Negative
c755ab63-258d-437b-a8f5-eadaf47c4bb9,5,4,5,4,4,4,5,4,5,5,5,5,4,4,4,5,5,5,5,5,4,4,4,5,4,5,5,4,5,4,I'm truly fantastic with the recognition I've received.,Positive
4e9b565f-47ac-420a-a68f-a023000015c7,4,4,4,3,4,4,4,4,3,4,3,3,4,4,4,4,3,3,3,4,4,4,3,4,3,3,4,4,4,4,My benefits are fine and meet my basic needs.,Neutral
9798d6cd-256c-487d-a7c9-ee333078135f,1,1,1,1,2,1,1,1,1,2,1,2,1,2,2,2,1,2,1,2,1,2,2,1,2,1,1,2,1,2,The tools and resources provided are unhappy to perform my job effectively.,Negative
201a9957-9f92-49ae-9596-ac5e1455555e,3,3,4,3,4,4,4,3,4,3,3,3,4,4,4,3,3,3,4,3,4,4,4,3,3,3,3,3,3,3,Everything is just regular. There's nothing much to say.,Neutral
5f65643d-72a3-4b8f-b8b8-79f0e5401bd5,1,1,1,1,1,2,2,1,2,2,1,2,1,2,2,2,2,2,2,1,1,2,2,1,1,2,1,2,1,2,Communication is a poor here. I am poor with management.,Negative
3c72cfe7-b17a-433e-b2d9-125cb5c87910,3,3,4,4,4,4,3,4,3,3,3,3,4,4,3,3,3,3,3,3,3,4,4,4,4,3,3,3,4,3,My job is adequate. The responsibilities are adequate.,Neutral
f759b755-a898-49dc-9694-a8cd4ffd0506,5,5,5,5,4,5,4,4,4,4,4,5,5,5,5,5,5,5,5,5,4,4,5,5,5,4,4,5,5,5,I am wonderful with the company culture.,Positive
3d2bf7d2-bc77-44b4-a092-900555ba9608,1,2,1,1,2,2,1,1,1,2,1,2,2,2,1,1,2,2,2,2,1,1,2,1,2,2,2,2,1,2,The recent organizational changes were communicated in a poor manner.,Negative
fb1fdd5e-74af-40dd-a68a-c437ba3287ce,3,3,3,3,3,3,3,4,4,4,3,4,4,3,4,3,3,4,3,4,4,4,4,3,3,4,4,3,3,3,My benefits are normal and meet my basic needs.,Neutral
35433e01-cf72-4fa4-96c3-41fa0dd6e89a,4,4,5,4,5,4,5,4,5,4,4,4,4,4,5,5,4,4,5,4,5,4,5,5,4,5,5,4,4,4,The compensation is supportive and I feel supportive supportive.,Positive
61e0f1bf-bb58-4398-ab04-71a8bd886ae5,1,1,1,1,2,1,1,2,1,2,2,1,1,2,1,2,2,1,1,2,1,1,1,1,2,2,1,2,1,2,The workload is stagnant and I have a stagnant work-life balance.,Negative
46f91d8b-d9b5-4b22-9914-ffa94a625b15,3,4,3,4,3,4,3,4,4,4,3,4,3,4,4,3,3,4,3,4,3,4,3,3,3,3,4,4,3,3,I have mixed feelings. The new policy is standard.,Neutral
ea52f1e3-ab69-411b-8b52-1199e6e85767,3,3,3,3,3,3,3,4,3,4,4,4,4,3,4,4,3,4,3,3,4,3,3,3,3,4,3,4,3,3,My benefits are acceptable and meet my basic needs.,Neutral
61a26f48-dadb-47f2-a4cc-7b2eeb0b0520,2,2,1,2,2,2,2,1,2,2,1,2,1,2,2,1,2,1,2,2,1,2,2,1,2,2,1,1,2,2,I'm difficult with my salary. It is difficult for my experience.,Negative
939b4f8f-a609-4fdf-8432-b8843de59e7b,4,4,4,4,3,3,3,3,3,4,3,4,4,3,3,4,3,3,3,4,3,3,4,4,3,4,4,3,3,4,My job is average. The responsibilities are average.,Neutral
9889984f-22c0-437b-9349-e2f7170f53fd,4,5,5,4,5,5,4,5,4,5,5,5,5,4,5,4,4,4,5,5,4,4,5,5,4,4,4,4,4,5,The company's mission is proud and I feel aligned with its values.,Positive
9f32c500-06f4-4448-862b-a53dfc5435cd,4,4,3,4,3,4,4,4,4,4,4,4,4,3,3,4,3,4,3,4,4,4,4,4,3,4,3,4,4,3,Everything is just acceptable. There's nothing much to say.,Neutral
28ebd219-64c5-44f5-bf6a-73025bb4e246,3,3,4,3,4,4,4,3,4,3,3,3,3,3,4,4,3,3,3,3,3,4,4,3,4,3,4,4,4,3,Everything is just adequate. There's nothing much to say.,Neutral
2f6ba2b8-30cb-4b30-8873-7cdee32af4d2,2,2,1,2,1,2,1,2,1,1,2,1,1,1,1,2,1,1,1,2,2,2,2,1,1,2,1,2,1,2,I've found career progression to be problem and unclear.,Negative
416fb55a-b8b1-4b82-89d0-15434acfe5c0,5,4,5,4,5,5,5,5,4,5,5,4,5,4,4,4,4,4,4,4,4,5,4,4,5,5,5,4,5,4,I'm truly supportive with the recognition I've received.,Positive
6ada0af6-d06f-4317-b21e-644eddb46ef3,1,1,1,1,2,2,2,1,1,2,2,2,2,2,1,2,1,1,1,2,1,1,1,1,2,1,2,2,1,2,The tools and resources provided are problem to perform my job effectively.,Negative
cce8774b-8ed8-4f86-b6ab-6889aa542b73,5,5,5,5,4,5,4,4,4,5,4,5,5,5,4,5,5,4,4,4,5,4,5,4,5,5,5,5,5,5,The compensation is proud and I feel proud proud.,Positive
b04d0b03-594a-418f-b1cc-e7e5a49331b9,4,3,4,4,4,4,4,4,4,3,4,3,3,3,3,3,4,3,3,3,3,3,3,3,4,3,3,3,4,3,The company's approach to innovation is quite typical.,Neutral
740ef163-c462-4e07-a0fe-b2033498174c,4,3,3,4,3,4,4,4,4,4,3,4,3,4,3,3,3,4,4,3,3,4,3,3,3,3,4,4,3,3,My benefits are expected and meet my basic needs.,Neutral
0f6aa0d5-eb74-4036-a415-e258ad509aa6,4,4,4,5,4,4,5,5,4,4,5,4,4,4,5,5,4,4,5,5,4,4,5,5,5,4,5,5,5,5,I'm truly happy with the recognition I've received.,Positive
383b2962-4df9-4ce0-91f0-504e17812fc9,4,5,4,5,4,5,5,5,5,4,5,5,5,4,4,4,4,4,5,4,5,4,4,4,4,4,4,4,4,5,The company's mission is wonderful and I feel aligned with its values.,Positive
39b2708c-c454-4dcd-82c4-d3618b002bdc,4,3,3,3,3,4,4,4,3,4,3,4,4,3,3,3,4,3,4,3,3,4,4,3,4,3,3,4,3,4,The company's approach to innovation is quite acceptable.,Neutral
e0d08e1d-9c78-4d65-a476-7be271d45e54,1,1,1,2,1,1,1,1,2,2,2,1,1,1,1,1,2,1,1,2,2,2,1,1,2,1,1,2,2,2,The tools and resources provided are stagnant to perform my job effectively.,Negative
b8bcbd3c-f92d-4ecf-bdde-b625fdc37a19,1,1,1,1,1,1,1,1,1,1,2,1,1,2,2,2,2,1,1,1,1,1,2,1,1,1,2,2,1,2,I'm mess with my salary. It is mess for my experience.,Negative
1b794a05-b158-4216-a91b-e58f559cca85,2,2,2,1,1,1,2,1,2,1,2,1,2,1,2,1,2,2,1,2,2,1,2,2,1,1,2,2,1,1,There's a mess culture and a mess of respect.,Negative
55b53bb0-6381-4a94-885c-5a359ffa6854,1,2,1,1,2,1,2,1,2,1,1,1,1,2,1,2,2,1,1,2,2,2,2,2,2,1,2,1,2,2,The workload is mess and I have a mess work-life balance.,Negative
ce1b293a-bd93-4129-b8f4-da89a374124b,5,4,5,5,4,5,5,4,4,5,5,4,5,4,5,5,4,4,5,5,4,5,5,5,5,4,4,4,5,4,The compensation is valued and I feel valued valued.,Positive
575c608b-0c5a-47c9-acb8-126d1bd7c9ee,1,2,1,1,1,1,1,2,1,1,2,1,1,1,2,2,1,1,1,2,1,2,2,2,2,2,1,1,1,1,I've found career progression to be low and unclear.,Negative
cacc269a-1916-4fe9-a2bf-7076e797697a,4,4,4,4,3,3,3,4,3,4,4,3,3,3,3,4,4,4,4,3,4,3,4,3,4,3,3,4,3,3,The training provided is regular. It serves its purpose.,Neutral
f88c7467-1d4d-4a9a-8de5-c4af42fa1fe9,1,2,2,2,1,2,2,1,2,1,2,2,2,2,2,2,1,1,1,1,1,2,1,1,1,1,1,1,1,1,The tools and resources provided are problem to perform my job effectively.,Negative
9d81adf2-c9be-40bb-87cd-45dc74be07f1,4,4,3,4,3,4,3,3,3,4,3,3,4,3,3,4,4,3,3,3,3,3,4,3,4,3,4,3,3,3,Performance evaluations are fine and generally follow the same format.,Neutral
aa94693a-2629-471a-a446-d46c6bc05bc2,4,4,5,4,4,5,4,4,5,5,5,4,4,5,4,5,5,4,5,4,5,5,4,5,5,4,5,5,4,5,I feel valued about my job. The team is valued.,Positive
06a79164-e6e0-4df3-92e9-d8d971f54f49,4,5,5,5,5,5,4,4,4,4,4,5,4,5,4,5,4,5,5,4,5,5,5,4,4,4,5,4,5,4,The workplace environment is wonderful and promotes wonderful collaboration.,Positive
e22d66b3-2f77-45ed-aca6-406ac70d19e4,5,5,5,4,5,5,5,4,5,5,4,4,5,5,5,5,5,4,4,4,5,4,4,4,5,5,4,4,4,4,The professional growth opportunities here are love.,Positive
f3e88221-a512-4a5b-9344-f121b126ec58,4,4,4,4,4,4,5,4,4,5,5,4,4,4,4,5,5,5,5,4,4,4,4,5,5,4,5,4,5,5,The compensation is excellent and I feel excellent excellent.,Positive
2b51252a-7ba4-4a23-908e-1d10eb65a4b1,4,4,3,3,4,3,4,3,4,4,3,4,3,3,3,3,3,3,4,3,4,4,4,4,4,3,3,4,3,4,The training provided is typical. It serves its purpose.,Neutral
dfb17d8d-ae79-4d3a-82fb-d467523bf646,2,1,2,1,1,2,2,1,2,1,2,2,1,2,1,1,2,1,1,1,2,2,1,2,2,1,2,1,1,2,The tools and resources provided are toxic to perform my job effectively.,Negative
43229736-9287-4aa7-a4c2-8c844221b2e8,1,1,1,2,1,2,1,1,2,1,2,2,2,1,2,1,1,2,2,1,2,2,1,1,2,2,2,2,2,2,"My contributions feel completely low, and I am not low for my work.",Negative
969e3ca2-fbd5-406a-82cf-8babb7fdf44e,1,2,1,1,1,1,2,2,2,1,1,2,2,1,2,1,1,2,2,1,1,1,1,1,1,1,2,2,2,1,The recent organizational changes were communicated in a terrible manner.,Negative
a8e19310-5f53-461f-8170-2bcc2baf78a3,3,4,4,4,4,4,3,3,3,4,4,4,3,4,4,3,4,4,4,4,3,3,3,4,4,3,4,3,4,4,I find the level of autonomy to be adequate.,Neutral
59a43911-e91e-4dcb-98c1-d1d9918e5005,1,2,1,1,1,2,2,2,2,2,2,2,2,1,1,2,2,1,2,1,2,2,2,1,1,1,2,1,2,2,I've found career progression to be unbearable and unclear.,Negative
1beae255-4735-49bd-a8db-470a16ca5193,1,2,2,2,1,2,2,1,2,2,2,2,1,2,1,1,1,1,1,2,2,1,1,2,2,1,2,2,1,2,The tools and resources provided are toxic to perform my job effectively.,Negative
b2ff7c50-672f-4712-8510-694cf019410f,4,4,5,4,4,5,4,4,5,4,4,4,4,4,4,4,4,5,4,5,4,5,5,4,4,5,4,5,4,5,The workplace environment is valued and promotes valued collaboration.,Positive
35c9514f-9e83-4dda-b3c4-93343fa2d9b4,4,4,3,4,4,4,3,4,4,4,4,3,3,3,3,3,4,3,3,4,3,4,4,3,3,4,4,3,3,4,The training provided is standard. It serves its purpose.,Neutral
bd915dbc-3be6-4f86-bda1-b2dc3c17479a,5,5,4,4,4,5,4,5,4,5,5,4,4,5,5,5,5,4,5,5,4,4,5,5,4,4,5,5,5,4,My manager is so great. I am great with the leadership.,Positive
a4ce788f-ff9c-4622-91b9-d0d5774ab05d,4,4,4,3,4,3,3,3,4,3,4,4,4,4,4,3,3,3,4,3,4,3,4,4,4,3,4,4,4,3,I find the level of autonomy to be normal.,Neutral
3190a830-d4de-479a-8cc2-ae730a0084dd,1,2,2,2,1,2,1,2,2,2,2,2,2,2,2,1,2,2,1,1,1,2,2,1,2,1,2,2,1,2,The tools and resources provided are poor to perform my job effectively.,Negative
236da818-4d7e-4a64-9808-542ed3e3e974,3,4,3,3,3,3,4,4,4,4,4,3,3,3,3,4,3,4,3,4,3,3,3,4,4,3,4,4,3,3,My benefits are normal and meet my basic needs.,Neutral
48d7d420-49f5-44b0-9be4-2c39cc3c9396,1,2,2,1,1,1,2,1,2,1,1,1,2,1,1,1,1,2,2,1,1,2,1,1,1,2,1,1,1,2,I'm stagnant with my salary. It is stagnant for my experience.,Negative
64b4221c-d259-4506-af5e-f77a829d69f0,5,4,4,4,4,5,5,4,5,5,5,4,4,5,5,5,5,5,5,4,4,5,4,4,5,5,5,5,4,4,I am excellent with the company culture.,Positive
15f815b6-604c-48ad-9f2a-95b92a288932,2,1,1,1,2,1,2,1,2,1,1,1,2,2,1,2,2,1,2,2,1,2,1,1,2,2,1,2,2,1,Communication is a unbearable here. I am unbearable with management.,Negative
f5eaa069-59d8-4044-a068-d9b75b946b3a,5,5,4,4,4,5,5,5,4,5,5,5,4,5,5,5,5,5,4,5,5,5,4,4,4,4,4,4,5,5,The professional growth opportunities here are happy.,Positive
e3cc4b46-9d63-4bf2-ac75-4c096224d152,4,3,4,4,4,4,4,4,3,4,4,4,4,3,3,3,4,4,3,4,4,3,3,4,4,3,3,3,3,3,The company's approach to innovation is quite normal.,Neutral
20c019a0-ed33-461d-a6de-b38727607dff,1,2,1,2,2,1,2,1,2,1,1,2,2,1,2,1,1,1,2,2,1,1,2,2,1,2,1,2,2,1,The tools and resources provided are toxic to perform my job effectively.,Negative
1b8ef2dc-7ebf-4b74-85cb-ce960d1c0fa7,2,1,2,2,1,2,2,1,1,1,2,2,1,2,1,1,1,1,2,2,1,1,1,1,1,1,2,2,1,1,I've found career progression to be difficult and unclear.,Negative
4b42650b-2681-4942-90ee-379dd3ad0496,4,4,4,4,3,3,3,4,4,4,3,3,4,3,3,3,4,4,4,3,4,3,3,4,3,4,4,4,3,4,My benefits are average and meet my basic needs.,Neutral
b1bbeac8-8439-461f-8e92-5071ac31e25b,1,1,2,2,2,1,2,1,1,1,1,1,1,2,1,1,1,2,1,1,2,1,2,1,1,1,2,1,1,2,The recent organizational changes were communicated in a problem manner.,Negative
2685a118-2e96-42a1-acd2-6c697137211d,4,3,3,4,4,4,3,4,3,4,3,3,4,4,4,4,4,4,3,3,4,4,4,4,4,4,4,4,3,4,Everything is just normal. There's nothing much to say.,Neutral
147f1584-e85d-4e13-9d6a-e48a3eaa52fb,4,5,4,4,5,5,5,5,5,5,5,5,5,5,4,5,4,5,5,4,5,5,5,5,5,4,4,4,5,5,I'm truly great with the recognition I've received.,Positive
