uid,salary_fairness,compensation_competitiveness,benefits_adequacy,workload_balance,schedule_flexibility,leave_policies_adequacy,workplace_safety_comfort,positive_inclusive_culture,access_to_tools_resources,professional_growth_opportunities,training_skill_development,clear_career_paths,manager_communication_clarity,raising_concerns_comfortability,manager_support_for_employees,job_security_feeling,organizational_financial_stability,open_communication_on_changes,team_collaboration_effectiveness,colleague_respect_support,constructive_conflict_management,clear_job_responsibilities,autonomy_in_role,role_alignment_with_skills,acknowledgement_of_contributions,fair_performance_evaluations,fair_rewards_for_effort,mission_values_meaningful,encouragement_of_innovation,Company_acts_ethically,free_text_box,sentiment_label
c1cf6d0e-1599-4f37-8748-9601e52ee7ef,1,2,2,1,2,1,2,2,1,1,1,2,1,1,2,2,1,2,2,1,1,1,1,1,1,1,1,2,2,1,Communication is a unbearable here. I am unbearable with management.,Negative
38409a63-20d5-48a3-8e15-c31ce7d19968,2,1,1,2,2,2,1,2,1,2,2,2,2,2,2,1,2,1,1,1,2,2,2,2,1,1,2,2,1,1,The tools and resources provided are toxic to perform my job effectively.,Negative
2cf2bd04-681b-4772-8b2f-70a3b925b958,3,4,4,4,3,4,3,4,3,3,4,3,3,3,3,4,3,3,3,4,3,3,3,4,4,4,3,4,4,3,Everything is just expected. There's nothing much to say.,Neutral
ea718cb3-19f6-43de-a2af-b7b91cbed8b0,3,4,4,3,4,3,3,4,4,4,3,3,4,3,4,4,3,4,3,3,4,3,3,3,4,3,4,4,4,4,My job is fine. The responsibilities are fine.,Neutral
abab4934-80ba-4a68-a90e-44e0d0450b6c,3,3,4,4,4,3,4,4,4,3,3,3,4,4,3,3,3,3,4,4,3,4,3,4,4,3,4,3,4,3,Everything is just okay. There's nothing much to say.,Neutral
d9a625f7-8067-4e01-9f9e-1ecd798efce1,4,5,5,4,5,4,5,4,5,4,5,5,5,5,4,5,4,4,4,5,4,4,4,4,4,4,5,5,4,4,The professional growth opportunities here are fantastic.,Positive
7f72a4a3-8a63-46fe-9cc6-d6fedf891a79,2,2,2,1,1,2,2,2,1,1,2,1,2,2,2,1,2,2,2,2,1,2,1,2,2,2,1,2,2,1,The tools and resources provided are unhappy to perform my job effectively.,Negative
4a17c2ac-0e5f-4d79-8dbe-daa21b15e081,5,4,5,5,5,5,4,5,5,4,5,4,4,4,5,4,4,4,4,5,5,5,4,4,5,4,4,5,4,5,The workplace environment is wonderful and promotes wonderful collaboration.,Positive
b365b609-02e9-484e-a4e8-4d110a199202,3,4,4,4,4,3,3,3,3,4,3,3,4,3,3,3,4,4,3,3,4,4,3,3,4,3,4,3,4,4,My benefits are adequate and meet my basic needs.,Neutral
460c79f3-43e7-4601-b459-9be1242d13fc,5,4,5,4,4,4,5,5,5,5,5,5,5,5,5,5,4,5,4,4,4,4,5,4,5,4,5,4,5,4,I am enjoy with the company culture.,Positive
410c9c9f-9c90-4a04-a543-70eff65c7094,3,4,4,4,3,4,3,4,3,3,4,3,3,3,3,4,4,3,4,4,4,3,3,3,3,3,4,3,4,4,The training provided is normal. It serves its purpose.,Neutral
2997cf36-1556-414d-9b2f-451fd49cd167,2,1,1,1,2,2,2,1,1,1,1,1,2,2,2,1,2,2,2,2,1,1,1,1,2,2,2,1,1,1,I've found career progression to be terrible and unclear.,Negative
6dcb65dc-19fd-4057-bac8-535c5aa35ef5,2,2,1,1,2,1,2,2,1,1,1,2,2,1,1,2,2,1,1,1,2,2,1,1,2,2,2,2,2,2,The recent organizational changes were communicated in a toxic manner.,Negative
0b0fe66f-4037-4a0e-92b7-38e7984be80e,1,1,1,1,2,1,2,1,1,2,2,2,2,1,1,1,2,2,2,1,2,1,2,2,1,1,1,2,1,2,I'm unbearable with my salary. It is unbearable for my experience.,Negative
65fd09c4-9282-42fa-978d-a708298f2d47,4,4,4,4,4,3,4,3,4,3,3,3,3,4,4,4,4,3,4,4,4,4,3,3,3,3,4,3,4,3,The company's approach to innovation is quite adequate.,Neutral
73010d51-8cae-4b53-bf09-a9c615a766f8,4,3,3,3,4,4,4,3,4,4,3,4,3,3,3,4,3,4,4,3,3,3,4,3,4,4,4,4,3,3,My job is average. The responsibilities are average.,Neutral
746b05a5-12c2-4459-b26e-ec4db82cb083,2,1,2,2,1,2,1,2,1,1,2,2,1,1,1,1,1,1,2,2,1,1,2,1,1,2,2,1,1,2,The recent organizational changes were communicated in a toxic manner.,Negative
194684d2-ccb2-40e2-82df-86e15beca6d3,5,4,5,5,4,5,5,5,4,5,5,4,5,5,4,4,4,4,5,4,4,4,4,4,4,5,4,4,5,5,I'm truly excellent with the recognition I've received.,Positive
a2e3cf0d-94fa-44f7-964c-bcbdfbe3c14d,1,1,1,2,1,1,2,1,1,1,1,2,2,1,1,1,1,1,2,1,2,1,1,1,2,1,2,2,1,2,The workload is low and I have a low work-life balance.,Negative
ff74267e-a4bf-40a4-93dd-978f6fa7b820,1,2,2,1,1,2,2,2,1,2,2,2,2,2,2,2,2,2,1,2,2,1,1,2,2,1,1,2,1,1,The recent organizational changes were communicated in a toxic manner.,Negative
4952caf8-ce16-40fe-816a-5109cf2c9264,2,1,2,2,2,2,2,2,2,1,2,2,2,2,2,1,2,1,2,2,2,1,1,2,1,2,2,1,1,2,There's a toxic culture and a toxic of respect.,Negative
9c2c0379-4139-4f1d-b1e5-af794a373841,3,4,3,4,4,3,4,4,4,3,3,4,4,4,4,4,3,4,3,3,3,4,3,4,4,3,4,3,3,4,The company's approach to innovation is quite average.,Neutral
faa3f69a-b3de-422e-8869-9240d71e9841,4,4,5,5,4,5,4,5,4,4,4,4,4,4,5,5,4,4,4,5,5,4,4,5,4,4,5,5,5,4,I'm truly fantastic with the recognition I've received.,Positive
a4d84afb-8830-463d-badd-6f64db188214,3,3,3,3,4,4,3,4,4,3,3,3,4,3,3,4,4,3,3,3,4,4,3,4,3,3,4,4,3,4,Everything is just normal. There's nothing much to say.,Neutral
1d26db92-5c5f-4ab4-bb9b-d5db54edeb1f,4,3,4,4,4,3,3,4,4,4,4,3,3,3,4,4,4,3,3,4,4,4,3,3,3,4,3,4,3,4,I find the level of autonomy to be normal.,Neutral
1727bc44-76cc-40bf-a4f9-034f57978695,4,4,5,4,5,5,4,5,5,4,4,5,4,5,4,4,5,4,5,5,4,5,5,5,5,4,5,5,5,4,I am enjoy with the company culture.,Positive
e79d4f6a-6961-4cdf-9813-721292420528,4,4,4,4,4,3,4,4,3,4,4,3,4,3,4,4,4,3,4,3,4,4,4,4,4,4,3,4,3,4,My job is okay. The responsibilities are okay.,Neutral
aa56b8f1-00fa-4a89-abdd-1145bc7cf126,5,4,5,5,4,4,4,4,4,5,4,5,4,4,5,4,5,5,4,5,4,5,5,5,4,4,4,4,4,5,The company's mission is supportive and I feel aligned with its values.,Positive
48bc61f4-f651-4323-a773-c543b596a1fb,2,2,2,2,2,1,2,1,2,2,2,1,1,2,1,2,2,2,1,2,1,1,1,2,2,2,2,1,1,2,I'm toxic with my salary. It is toxic for my experience.,Negative
29e5930d-aadc-4124-92bc-a84ca04198a3,5,4,4,5,5,4,4,5,5,5,5,5,4,5,4,4,4,4,4,4,4,4,5,4,4,4,4,4,4,4,My manager is so valued. I am valued with the leadership.,Positive
c7ece22b-c40c-40b7-950e-0c4fcfa29697,5,4,4,4,5,5,5,4,4,5,4,4,5,5,4,4,4,5,5,4,4,4,5,5,5,5,5,4,4,4,The professional growth opportunities here are supportive.,Positive
e2aed9cb-667a-4cfc-8192-8a7426244a99,4,4,4,5,4,5,5,5,4,4,4,5,4,5,4,4,5,5,4,5,4,5,5,4,4,5,5,4,4,5,I am fantastic with the company culture.,Positive
c63d5e83-a3a3-4c94-9d42-628651250a9b,4,4,4,4,5,4,5,4,5,5,5,5,5,4,5,5,5,4,5,4,5,5,4,5,5,5,5,4,5,5,The professional growth opportunities here are happy.,Positive
02267cec-c884-4a80-80d3-642ce9974082,2,1,2,2,2,1,1,1,1,2,2,1,1,1,1,1,2,1,2,2,1,2,2,1,1,1,2,2,1,1,The tools and resources provided are toxic to perform my job effectively.,Negative
fafdaacc-5820-479c-ba0c-554c661e6171,3,3,4,3,4,4,3,3,3,4,4,4,3,4,4,4,4,4,4,3,4,3,3,3,4,4,4,4,3,3,Performance evaluations are acceptable and generally follow the same format.,Neutral
bacc15c5-a78d-4abf-8a21-3d18ace044ca,4,3,3,3,4,3,4,4,4,3,4,3,3,4,4,4,3,3,4,3,4,4,4,4,4,4,3,3,4,4,The company's approach to innovation is quite regular.,Neutral
829fa469-97d4-4203-83d8-84cf7f896f9f,4,5,5,4,4,4,4,4,5,5,4,4,4,5,5,4,4,5,5,5,4,5,5,5,5,4,4,4,5,5,I am wonderful with the company culture.,Positive
3eb404ee-9b93-4cf6-83eb-b22be494cd27,4,5,4,5,5,5,5,5,4,5,5,5,4,4,5,5,5,5,4,4,5,4,4,4,4,4,5,4,4,5,I am happy with the company culture.,Positive
beff55de-2917-4f06-b3ce-250be80dc8ea,5,4,5,4,4,4,5,5,5,5,5,5,5,5,5,4,4,5,5,4,4,5,5,5,5,4,5,5,4,4,The workplace environment is happy and promotes happy collaboration.,Positive
6e59054a-1878-4035-87b5-848de887253d,4,5,4,5,5,5,5,4,5,4,5,4,4,4,4,5,4,5,4,4,4,4,5,4,5,4,5,5,4,4,The professional growth opportunities here are excellent.,Positive
47010516-6ca8-42f8-b4ea-aa295710995d,3,3,3,3,3,4,4,4,3,3,3,3,3,4,4,4,4,3,3,4,3,3,3,3,4,3,3,4,3,3,My job is average. The responsibilities are average.,Neutral
06152a4b-149f-4a28-8942-9352c5622e16,3,4,4,4,4,4,4,3,4,4,3,4,4,3,3,4,4,3,4,4,3,3,3,4,4,3,4,4,3,4,Performance evaluations are acceptable and generally follow the same format.,Neutral
a6fd76de-a724-4cd6-9cb3-c21696698157,1,1,1,2,1,2,1,1,1,2,1,1,2,1,2,2,1,1,2,1,1,1,2,2,1,2,2,2,1,1,I've found career progression to be unhappy and unclear.,Negative
c21e269b-f596-4359-9a43-fd1c9e0f2786,4,3,3,3,3,3,4,4,4,3,4,4,3,4,4,4,3,4,3,4,3,3,3,3,3,3,3,4,4,3,My job is expected. The responsibilities are expected.,Neutral
8b20a289-94c1-4751-854d-05ec14c93eaa,4,3,3,4,4,4,3,3,3,4,4,3,3,3,3,4,4,3,4,4,3,4,4,3,4,3,3,4,4,4,My job is adequate. The responsibilities are adequate.,Neutral
f94dda6a-5420-41db-9a92-8301565848ff,4,4,5,5,4,5,5,4,4,4,5,4,4,5,5,5,4,5,4,5,5,4,5,5,5,4,4,5,5,5,The company's mission is supportive and I feel aligned with its values.,Positive
bff41479-b6bc-4086-aad2-5c3dbfc72631,2,2,2,2,2,1,2,1,2,1,2,1,2,2,2,1,1,1,2,1,2,2,1,1,2,2,2,1,2,2,I'm toxic with my salary. It is toxic for my experience.,Negative
b6a3e4b1-46f7-4fd9-b005-9a8f076ae013,2,1,2,2,2,1,1,1,2,2,1,1,1,1,1,2,1,2,1,2,2,2,2,1,2,1,2,2,2,1,"My contributions feel completely toxic, and I am not toxic for my work.",Negative
bac4c6a9-0002-4636-8bfc-17c16f510f5e,2,2,1,2,1,2,1,1,1,1,1,2,1,2,2,2,2,2,2,1,1,1,1,2,2,1,1,2,2,1,Communication is a low here. I am low with management.,Negative
e4e24be4-f211-4db9-a350-c6fa3fd4ccad,3,4,4,3,3,4,3,3,3,4,3,4,3,4,4,4,4,3,3,4,3,3,3,3,3,4,3,4,4,4,The company's approach to innovation is quite normal.,Neutral
02bd92ee-2b41-41a7-ba91-2da1160e92bc,3,3,4,4,4,4,3,3,3,4,3,3,4,3,4,4,4,4,4,3,4,4,3,4,3,4,4,4,4,3,My job is fine. The responsibilities are fine.,Neutral
8218458e-e5b8-4fc6-8c0f-50e44b9c19fd,2,2,2,1,1,2,2,1,2,2,1,1,2,2,2,1,2,2,1,1,2,2,2,2,2,2,1,2,2,1,I'm toxic with my salary. It is toxic for my experience.,Negative
2114a4e5-6344-42e1-a9ad-e4762968b6dd,4,3,3,3,4,4,4,4,4,4,4,3,4,3,4,3,4,4,3,4,3,4,4,4,4,4,4,3,4,3,The company's approach to innovation is quite okay.,Neutral
366012cc-51be-4b07-80be-38e2e5cf37fd,4,5,5,4,5,4,4,4,5,4,5,4,5,5,4,4,5,5,4,5,4,5,4,5,4,4,4,4,4,4,I feel fantastic about my job. The team is fantastic.,Positive
ba3bed18-3640-4ea3-aa79-e88b15343983,5,5,5,4,4,5,4,5,4,5,5,4,4,4,5,4,4,4,4,5,5,4,4,5,5,4,5,4,5,5,The compensation is fantastic and I feel fantastic fantastic.,Positive
07caff34-6311-493f-8769-bc5b6b6b4d97,4,4,3,3,3,3,3,3,4,3,3,3,3,4,4,3,4,4,4,3,3,3,4,3,3,4,3,4,3,4,The training provided is expected. It serves its purpose.,Neutral
b9eebd68-1dc2-4cc7-8ec5-6d6df1f12ba7,5,4,5,5,4,5,5,4,5,5,5,4,5,4,4,4,5,5,5,4,4,4,4,4,4,5,5,5,4,4,I feel excellent about my job. The team is excellent.,Positive
fff4807b-a065-4aad-a862-d8a6bae87468,4,5,5,5,5,4,4,4,4,5,4,5,5,5,4,4,4,5,5,5,5,5,5,5,5,5,5,5,5,4,I'm truly wonderful with the recognition I've received.,Positive
99f81b83-2655-4605-ac39-ad6c4b1b750b,5,4,4,5,4,4,5,4,4,4,4,4,4,4,4,5,5,5,5,4,5,5,4,5,5,5,4,4,5,5,The compensation is enjoy and I feel enjoy enjoy.,Positive
e8346664-a982-4cb7-8285-af19e8387fc5,2,1,1,2,2,1,2,2,2,1,1,1,2,1,1,1,1,1,1,2,1,1,2,2,2,2,2,1,1,2,There's a terrible culture and a terrible of respect.,Negative
7f7e5ec0-5645-477c-a2be-fca18cfea96f,3,3,4,4,4,4,4,4,3,4,3,3,4,3,4,4,4,4,4,4,4,4,4,3,3,3,4,4,3,4,My job is typical. The responsibilities are typical.,Neutral
b55045c1-8f3b-4fb0-8e6d-291c4ae999ba,5,5,4,4,4,4,5,4,4,5,5,4,4,5,5,4,5,4,4,5,5,4,4,5,4,4,5,5,4,4,My manager is so wonderful. I am wonderful with the leadership.,Positive
6608e4db-2ff7-49f8-a646-38c688868d46,5,5,4,4,4,4,4,5,5,5,4,4,4,5,5,5,5,4,5,4,5,5,5,4,5,4,4,5,5,5,I feel proud about my job. The team is proud.,Positive
c82dafe4-80e5-450b-85ff-3410e26d0bff,4,4,4,5,4,4,4,4,4,4,4,4,5,4,4,4,4,5,5,5,5,5,4,5,5,5,4,5,4,4,The compensation is love and I feel love love.,Positive
4f8c95ab-47b1-409e-96db-3e2b4e3e4e73,4,3,3,3,4,4,3,4,3,4,3,4,3,3,4,4,3,4,3,3,3,3,4,3,4,3,4,4,4,4,I have mixed feelings. The new policy is normal.,Neutral
3fcaecfd-73f2-4e2e-84ff-f23f789b8d5a,5,4,4,4,4,5,4,5,4,5,4,5,5,4,5,4,4,5,4,5,5,5,4,5,4,5,5,4,4,4,My manager is so excellent. I am excellent with the leadership.,Positive
2a9ec25d-12cc-4045-a010-a2ab04583d34,1,1,1,1,1,1,2,2,1,1,2,1,1,1,1,2,2,2,1,1,1,1,1,2,1,2,2,1,2,2,The workload is difficult and I have a difficult work-life balance.,Negative
7e356a7d-2b20-427b-b562-476714ba3b2b,3,4,3,4,4,3,4,4,3,3,3,4,3,3,4,4,4,4,3,4,4,4,4,4,4,3,4,4,4,4,My job is standard. The responsibilities are standard.,Neutral
d6e2294f-f593-4362-9c8d-d5d18530191c,4,3,3,4,4,3,3,3,3,3,3,3,4,3,4,4,3,4,4,3,4,3,4,3,3,3,3,3,4,4,I find the level of autonomy to be standard.,Neutral
88073565-d84a-4d55-867c-a3ac24752052,4,5,5,4,4,5,5,4,5,5,5,4,5,4,4,5,5,4,4,4,4,5,4,5,4,4,5,4,5,5,The professional growth opportunities here are fantastic.,Positive
274032c2-bc1f-4222-b00b-acade4e58069,2,1,1,2,2,1,1,2,2,2,1,2,1,2,2,1,1,2,1,1,1,1,1,2,1,1,1,2,1,1,I'm low with my salary. It is low for my experience.,Negative
c02a2536-5f40-4720-968b-cccb6fe61dbc,3,4,3,3,4,4,4,4,3,3,4,4,4,3,4,4,3,4,3,4,3,4,3,3,4,4,4,4,3,4,Performance evaluations are okay and generally follow the same format.,Neutral
10543d7a-9a7c-47a5-a451-0b2a98b3df45,3,3,3,4,3,3,3,4,4,4,3,3,3,4,3,4,4,3,3,3,3,4,4,4,4,4,3,3,4,4,I find the level of autonomy to be normal.,Neutral
6866d1a4-6c2d-49d8-b041-417807388681,3,4,4,4,3,3,3,3,4,3,3,4,4,3,3,4,3,3,3,4,3,3,3,3,3,4,3,4,3,3,I have mixed feelings. The new policy is acceptable.,Neutral
654f683b-a2c5-451e-b318-75716383ec2f,4,4,4,5,4,5,5,5,4,4,5,4,4,5,4,4,5,5,5,4,5,4,4,4,5,4,4,5,4,4,The professional growth opportunities here are love.,Positive
81202d81-b38c-47e0-891c-5008a3d77388,4,3,4,4,4,4,3,4,3,4,4,3,4,3,4,4,3,4,4,4,4,3,3,4,4,3,4,3,3,4,I have mixed feelings. The new policy is expected.,Neutral
4d24eb35-6639-45e9-ab19-d19042d08761,3,4,4,4,3,4,4,4,4,3,3,3,4,3,3,4,3,3,4,3,4,3,3,4,3,3,4,4,3,3,I find the level of autonomy to be okay.,Neutral
837314dc-f415-493e-95fd-1b4003777b6a,3,4,4,3,4,4,3,3,3,4,4,3,4,4,4,4,4,4,4,4,4,3,4,4,4,3,4,3,4,4,My job is acceptable. The responsibilities are acceptable.,Neutral
f7a36f65-1373-4f7e-8b01-5367907d3f5a,3,4,3,4,4,3,4,4,4,4,3,3,3,3,3,3,4,4,3,4,4,4,4,3,3,4,4,3,3,4,The company's approach to innovation is quite expected.,Neutral
3132e8e6-b0b6-4c7b-b6ef-e8a628c69a41,5,5,5,4,5,5,4,5,4,5,4,5,4,4,4,4,5,5,4,5,4,4,5,4,5,4,5,4,5,5,The compensation is enjoy and I feel enjoy enjoy.,Positive
884c49c9-e910-4e41-a039-a3a0093f5db5,1,2,1,1,2,2,2,1,1,2,2,1,2,2,1,2,2,2,1,2,1,1,1,2,1,2,1,1,2,2,I'm unhappy with my salary. It is unhappy for my experience.,Negative
46e330dc-18a1-4e24-bc31-fe20a42e88b8,3,3,3,4,4,4,3,4,3,4,3,3,4,3,3,3,4,3,3,4,3,4,4,4,4,4,3,4,4,3,Performance evaluations are typical and generally follow the same format.,Neutral
bcd79e1c-12f9-4453-a490-0a842785050f,4,4,5,5,5,5,4,5,5,4,4,5,4,4,5,4,5,5,4,4,5,5,4,5,4,4,5,5,4,4,The company's mission is love and I feel aligned with its values.,Positive
2b9288eb-ac77-4bbe-883c-b4aa45c465c0,1,1,2,1,1,2,1,1,1,2,1,1,1,1,2,1,2,2,1,2,1,2,1,2,1,1,2,2,2,2,I've found career progression to be mess and unclear.,Negative
ea7cf2a4-61c1-44f5-8627-48b0b0265254,4,5,4,4,4,5,5,5,5,5,4,5,5,5,4,5,5,5,4,5,5,5,4,4,4,4,5,5,5,4,I feel fantastic about my job. The team is fantastic.,Positive
22ed2052-79c4-49cc-984c-553ad9c952d2,5,4,4,4,5,5,5,5,5,4,5,5,5,5,4,5,5,4,4,4,5,5,5,5,4,5,5,4,4,5,My manager is so wonderful. I am wonderful with the leadership.,Positive
517e3ea8-56d5-4e4d-8618-2da4d4258952,1,1,2,1,2,1,2,1,1,1,1,1,1,1,2,1,2,2,2,2,2,2,1,1,1,2,2,2,1,2,"My contributions feel completely stagnant, and I am not stagnant for my work.",Negative
6bb36ae5-4839-40e7-b7a4-8b6a51fbd3cc,1,1,1,2,1,1,2,2,2,1,1,2,1,2,2,2,2,1,1,1,2,2,1,2,2,2,2,1,2,2,I've found career progression to be terrible and unclear.,Negative
f91208f7-1df9-449b-8f28-b6e019b9ac1e,5,4,5,5,5,4,4,5,5,5,4,5,5,5,4,5,5,5,5,5,5,5,5,5,4,4,5,5,5,5,I feel excellent about my job. The team is excellent.,Positive
cbd915ff-e004-4a4a-b60d-6e631aeb96d9,2,1,2,1,1,2,1,2,2,1,1,1,1,1,2,2,2,1,1,1,2,1,2,2,1,2,2,2,2,2,Communication is a poor here. I am poor with management.,Negative
34c6730f-cdad-41e7-9768-d92884878e2a,1,1,2,2,2,2,2,1,2,1,2,2,2,2,2,1,2,2,2,1,1,1,1,2,2,2,2,1,2,2,I'm terrible with my salary. It is terrible for my experience.,Negative
8dc6baa1-4c74-48a7-be5f-06a3899f55de,4,3,4,4,4,4,3,3,4,4,4,3,3,3,4,3,4,3,3,4,3,4,3,4,3,4,3,3,4,3,I find the level of autonomy to be adequate.,Neutral
50c9612f-6888-46ce-9615-f9c60828948f,5,5,5,5,5,5,4,5,5,4,4,4,5,5,5,4,5,5,4,5,5,5,5,4,4,4,4,5,4,5,I'm truly love with the recognition I've received.,Positive
fc81d9cf-3004-4ba5-bc66-e1d89a5c9966,4,5,4,5,4,4,5,5,5,4,4,5,5,4,4,5,4,4,4,4,5,4,5,4,5,4,5,4,4,4,The professional growth opportunities here are valued.,Positive
9d24a929-44d9-4962-b7ad-3d291be218a5,3,4,4,4,3,4,3,3,3,4,4,3,4,3,3,3,4,3,3,3,4,4,3,3,4,3,4,4,3,3,Everything is just adequate. There's nothing much to say.,Neutral
e8103f3b-53c0-4d86-b211-bb7ec46bb203,4,3,3,4,3,4,3,4,4,3,4,3,3,4,4,4,4,4,3,3,3,3,4,3,4,3,3,4,3,4,I find the level of autonomy to be expected.,Neutral
5a686476-b457-48aa-94b5-04a78fa82519,2,2,1,2,1,1,2,2,2,2,2,1,1,2,2,2,1,2,2,2,2,1,2,2,1,1,2,1,2,1,I'm toxic with my salary. It is toxic for my experience.,Negative
f154e2db-80cd-4cf4-a0e5-8118542f896c,1,2,2,2,1,2,1,2,2,2,2,1,2,2,1,2,1,1,1,1,1,1,1,1,2,1,1,2,1,1,"My contributions feel completely poor, and I am not poor for my work.",Negative
185c4bb3-ffe6-4a71-8e46-e408b1400080,4,5,5,5,5,4,5,4,4,5,5,4,4,4,4,4,4,4,5,4,5,5,5,5,4,5,5,4,5,4,I'm truly love with the recognition I've received.,Positive
cda19402-3c53-4c32-a24a-154c5d675887,2,2,1,1,2,2,2,2,2,2,2,2,2,1,2,1,1,2,2,2,2,2,2,1,1,1,1,2,2,1,There's a stagnant culture and a stagnant of respect.,Negative
1690ac24-c00f-4e29-afbf-d8a432a32ede,1,1,2,2,2,2,2,1,1,1,1,1,2,2,2,2,1,1,1,2,2,1,1,1,2,1,2,1,2,1,The workload is stagnant and I have a stagnant work-life balance.,Negative
a085e960-7947-4999-be61-451199151c92,2,2,2,2,2,2,2,2,1,1,2,1,2,2,1,2,2,2,2,2,2,1,1,2,1,1,1,2,1,1,The tools and resources provided are difficult to perform my job effectively.,Negative
69fde4b8-9815-49f7-b5e8-3679ebb4e00f,1,1,2,1,2,1,2,1,2,1,1,2,2,2,1,1,1,1,2,2,1,1,1,2,1,2,2,1,2,1,The tools and resources provided are mess to perform my job effectively.,Negative
20582884-2ee5-4ee6-bffe-6637b45eab77,2,1,1,1,2,1,1,2,1,2,1,1,2,1,1,1,1,1,1,1,1,1,1,2,2,1,1,2,2,2,The tools and resources provided are problem to perform my job effectively.,Negative
e743dd70-410d-45fe-b70e-0df665c42e91,4,4,3,3,3,3,3,3,4,4,3,4,4,4,3,3,4,3,4,4,3,3,3,4,4,3,3,3,3,3,The training provided is regular. It serves its purpose.,Neutral
d5cdc051-79d3-462e-bbbe-5a2403223073,3,4,3,3,4,3,3,3,4,4,3,3,4,4,3,4,3,4,3,3,3,3,3,4,3,3,3,3,3,4,I have mixed feelings. The new policy is average.,Neutral
7322c1b2-0f98-4b18-a1f3-4d42b866719f,4,3,3,3,3,4,3,3,3,4,3,3,4,3,3,3,4,3,3,3,3,4,4,4,3,3,3,4,4,4,I find the level of autonomy to be okay.,Neutral
227a2fa3-36ce-455e-8e03-f46fd7711a8d,4,5,4,5,5,5,4,5,5,4,4,4,4,4,4,5,4,4,5,5,4,4,4,4,4,4,5,4,4,5,I feel proud about my job. The team is proud.,Positive
bf8a15df-e3df-4463-a669-50675613a8c5,1,2,2,1,2,1,2,2,1,1,2,2,2,1,2,1,2,1,1,2,1,1,2,2,1,1,1,2,1,1,The recent organizational changes were communicated in a stagnant manner.,Negative
630c45bc-4c26-4d42-8062-8c22f19c97be,2,1,1,1,2,1,2,1,1,1,2,1,2,1,1,1,2,2,1,2,2,1,2,2,2,1,2,2,1,1,"My contributions feel completely poor, and I am not poor for my work.",Negative
8e9491cb-de3e-4d18-9eb7-91f903e902d7,1,1,2,1,1,2,2,2,2,2,1,1,2,2,2,2,1,2,2,1,2,1,1,1,2,2,2,1,1,1,The tools and resources provided are toxic to perform my job effectively.,Negative
68266fa9-25d2-49c0-9754-a674858fa55e,1,2,2,1,2,2,2,2,2,2,1,1,1,2,2,2,2,2,2,1,2,2,2,1,1,2,2,1,1,2,The tools and resources provided are difficult to perform my job effectively.,Negative
82b49d14-d9f7-4803-973c-c69e0ba35c5b,2,1,2,2,2,1,2,1,1,2,1,1,1,1,2,1,1,2,2,2,1,1,2,2,2,1,1,2,2,2,The recent organizational changes were communicated in a poor manner.,Negative
402f6d08-94a9-44c9-b34a-185afdbcab02,3,4,4,4,4,3,3,4,4,3,4,4,3,4,4,4,3,3,3,4,4,4,4,3,3,3,3,3,3,4,My job is okay. The responsibilities are okay.,Neutral
a6f36989-0ae7-4a44-b692-2996ec068ac7,2,2,1,2,1,1,2,2,1,1,1,2,2,2,1,2,1,2,2,2,1,1,1,1,2,2,1,1,2,2,I've found career progression to be low and unclear.,Negative
612626f9-82e9-4a2f-8ec1-901227fb4fed,3,3,4,4,3,4,4,4,3,4,3,3,4,3,3,3,4,4,3,3,4,4,3,4,4,3,4,4,3,4,I have mixed feelings. The new policy is normal.,Neutral
f221bcbe-1d8a-4535-aa1c-e2c8edf12de0,4,4,4,3,4,4,3,3,4,4,4,3,4,4,4,4,4,3,4,3,4,3,3,3,3,3,3,4,4,4,Performance evaluations are typical and generally follow the same format.,Neutral
41ca81ff-51ad-479c-91f4-8a1e201ba7dc,2,2,1,1,1,2,1,1,1,2,1,2,1,1,1,1,1,2,2,1,1,2,1,1,2,2,1,1,2,2,The tools and resources provided are unbearable to perform my job effectively.,Negative
cfb26ba8-6872-43ea-854c-bacebd3a9d69,4,3,4,3,3,3,3,4,3,3,4,4,3,3,4,4,4,3,4,3,3,4,3,3,4,3,4,3,4,3,Everything is just standard. There's nothing much to say.,Neutral
321ed119-82c3-4c63-bdb1-47e6ab243e0e,1,2,1,2,1,2,1,1,2,1,2,2,1,2,1,2,2,1,1,1,2,1,2,2,2,2,1,1,2,1,I've found career progression to be unhappy and unclear.,Negative
acde5beb-0dd9-4edb-b70b-857aa3dcdf00,5,5,5,4,5,5,5,4,4,4,4,4,4,4,5,4,4,5,5,5,4,4,5,5,5,4,4,5,5,4,The workplace environment is supportive and promotes supportive collaboration.,Positive
04474326-e523-45e9-aabc-2af32b413727,3,3,4,3,4,4,4,3,3,4,3,3,3,3,4,4,4,3,3,3,4,4,3,4,3,3,3,4,4,4,The company's approach to innovation is quite regular.,Neutral
6687ca43-a7d0-4eb4-80e2-1720a162664c,1,1,1,2,2,2,1,2,2,2,2,1,1,1,2,1,1,2,1,1,1,1,2,2,2,2,1,2,1,1,The recent organizational changes were communicated in a toxic manner.,Negative
5f0081d2-98bb-43b8-b73d-bc2acfe8f2d8,4,3,3,4,3,3,3,4,3,4,3,4,3,3,3,4,4,4,3,3,3,4,4,4,4,3,4,3,3,4,The company's approach to innovation is quite acceptable.,Neutral
d3cc10a1-4a3d-4d80-81b7-ef3175145b53,3,3,3,4,4,3,4,3,3,3,4,3,4,3,4,3,4,3,4,3,3,3,4,3,4,4,3,4,3,4,I have mixed feelings. The new policy is typical.,Neutral
938b9113-4d26-409e-a27a-fd999191ce73,3,4,4,4,3,4,3,4,3,3,3,3,3,4,4,4,3,3,4,3,3,4,4,3,4,4,3,4,3,4,I have mixed feelings. The new policy is normal.,Neutral
48a1d7e7-29e3-4278-9e3a-5664ac25803f,5,5,4,5,5,5,4,5,4,4,5,4,5,5,5,5,4,4,4,4,4,4,5,4,4,4,4,5,4,5,The professional growth opportunities here are excellent.,Positive
30c00a3b-9086-484f-b84a-a036ddb3c993,4,4,5,5,5,4,4,5,4,5,5,4,4,4,5,4,5,5,5,4,4,5,4,5,4,4,4,5,5,5,I am great with the company culture.,Positive
6c3e6113-c74d-454c-8ce7-9262ab71418d,3,3,3,4,3,3,3,4,3,4,4,3,4,3,4,4,3,4,3,3,4,4,3,4,3,4,4,3,4,4,Everything is just typical. There's nothing much to say.,Neutral
f72f6b05-0a8a-4d53-bfbb-d4ee7cf9eabb,3,4,3,4,3,4,3,4,4,3,3,4,4,3,3,4,4,3,4,3,3,4,4,3,3,4,4,3,4,3,The company's approach to innovation is quite standard.,Neutral
26cf1b04-4c1f-4dc8-98bd-48cedd56c92b,4,4,4,4,4,3,4,3,4,3,3,3,4,4,3,4,3,4,4,3,4,3,4,4,4,4,3,4,4,4,Everything is just adequate. There's nothing much to say.,Neutral
6aa746a9-0e99-4662-a459-376410ada63e,1,1,2,2,1,2,1,1,1,2,1,1,2,1,1,2,1,2,1,1,1,2,1,2,2,1,2,2,1,1,"My contributions feel completely terrible, and I am not terrible for my work.",Negative
48e0c2c9-1de3-49e0-bee9-8a11f3e37bfa,4,5,4,4,5,5,4,5,4,5,5,4,5,4,5,4,5,5,5,4,4,4,4,4,4,4,4,5,5,4,The company's mission is fantastic and I feel aligned with its values.,Positive
e729f5b6-17d4-4485-8135-f7f123e85c69,4,3,3,3,3,3,3,3,4,3,4,4,3,4,3,4,4,3,3,4,3,4,4,3,4,4,3,3,4,3,I have mixed feelings. The new policy is normal.,Neutral
4abce33c-8703-4f03-8cf2-df3c2df37b55,4,4,4,4,5,4,5,5,4,5,4,4,4,4,4,4,5,4,5,5,4,5,5,4,5,5,5,5,4,4,The professional growth opportunities here are great.,Positive
8af823cb-ef2e-438d-9452-bc36701b1b84,3,4,3,4,4,3,4,3,3,3,3,3,4,4,3,4,4,3,3,4,4,3,3,4,4,3,4,3,4,4,My benefits are average and meet my basic needs.,Neutral
10faa8cd-592f-4448-ac57-6077c501fe6f,3,3,3,3,4,4,3,4,3,3,3,4,4,3,3,3,3,4,4,3,4,4,3,3,3,3,4,4,4,3,My benefits are average and meet my basic needs.,Neutral
02371e5d-635a-4855-9ce4-8f90a4263b93,4,4,4,5,5,5,5,4,5,4,4,4,4,4,5,4,4,4,5,5,5,5,4,5,4,5,5,4,4,5,I'm truly enjoy with the recognition I've received.,Positive
6d1dde55-35e0-4201-a035-dc692d38e3e4,4,4,4,5,4,5,5,5,5,4,4,5,4,4,5,4,5,4,4,5,4,5,5,5,5,5,4,4,4,4,The professional growth opportunities here are great.,Positive
ef6c33d4-b657-400c-a319-9888d6d9aa6d,4,4,4,5,5,5,5,4,4,4,5,5,5,5,5,4,4,4,4,4,5,4,4,5,5,5,4,4,4,5,I feel fantastic about my job. The team is fantastic.,Positive
cf869652-5fbe-4065-b5e9-118fe37ccd07,4,4,5,5,4,5,4,4,4,4,5,4,4,5,5,4,5,4,5,4,4,4,4,4,5,5,5,5,4,5,The workplace environment is proud and promotes proud collaboration.,Positive
494f149f-55d1-4d32-8b17-e1ec1ede104a,4,5,5,5,4,4,4,4,4,4,5,4,5,4,5,4,4,4,5,5,4,5,5,4,4,4,4,4,5,5,The workplace environment is happy and promotes happy collaboration.,Positive
f26370c1-be6b-4f88-b9a1-0e79b877132b,4,4,5,5,5,4,4,4,5,4,5,4,4,4,5,4,5,5,5,4,5,4,5,4,4,4,4,5,5,4,I am wonderful with the company culture.,Positive
1470de0e-b572-4c6c-9ded-e89acb9a5332,3,3,4,4,3,3,3,3,4,3,4,4,4,4,4,4,4,4,3,4,4,3,4,4,4,3,3,4,3,4,My benefits are normal and meet my basic needs.,Neutral
97fe31af-1566-4b6e-bf05-e27c40913d72,4,4,4,4,4,4,4,3,4,3,4,3,4,4,3,4,4,3,4,4,3,4,3,4,4,4,4,3,4,3,My benefits are regular and meet my basic needs.,Neutral
78775335-cdb3-4d36-877f-6cfd3c68f139,1,1,1,1,1,2,1,2,1,2,1,1,1,2,2,2,1,2,2,1,2,1,2,1,2,1,1,2,2,2,There's a toxic culture and a toxic of respect.,Negative
4881a55a-7bf6-4e4f-9958-594c246a02c3,3,3,4,3,3,4,3,3,3,4,3,3,4,3,4,4,3,4,4,3,4,3,4,4,4,4,4,4,3,4,The training provided is typical. It serves its purpose.,Neutral
0a645f85-5055-4bc4-a7e6-7878700c8e1e,4,5,4,5,4,4,4,5,5,4,5,5,4,5,4,4,4,5,5,5,5,4,4,5,5,4,4,4,5,5,The workplace environment is happy and promotes happy collaboration.,Positive
d11b6804-47e2-4533-bd38-80cf18f9dbb7,4,4,3,4,3,3,3,3,4,4,4,4,3,3,3,3,3,4,3,4,4,3,4,4,3,4,3,3,3,4,The training provided is regular. It serves its purpose.,Neutral
feedf4bf-60b6-45f7-91b1-32325e9923ec,2,2,1,1,1,2,1,2,2,2,2,2,1,1,1,2,2,1,2,2,1,2,2,1,1,1,2,1,1,1,The tools and resources provided are difficult to perform my job effectively.,Negative
8a2e4ccb-0bb9-4f30-a565-6e367aaf84fc,3,4,4,3,4,3,3,3,3,4,3,4,3,4,4,4,3,3,4,3,4,3,3,3,4,4,3,4,3,3,My benefits are average and meet my basic needs.,Neutral
54081626-ffa2-4960-a4b2-36a6d9dc881d,4,4,3,3,3,4,3,4,4,3,4,4,4,4,3,4,4,3,4,4,4,4,4,3,3,3,4,4,4,4,I have mixed feelings. The new policy is normal.,Neutral
98ad7a57-e1aa-494d-ad42-3667b8bdc0d8,2,1,1,1,1,1,1,2,1,2,2,2,1,1,1,2,2,1,2,2,2,2,1,1,1,1,1,1,1,1,I'm difficult with my salary. It is difficult for my experience.,Negative
